,en,ja
story.Prologue_Hallway_2.event_confused.text.0f908a4006b456c691ea2d7446fcf898600a4afc,Wait a moment.,ちょっと待って。
story.Prologue_Hallway_2.event_confused.text.a3949754c983ec8df6656cc830de355419716cfb,This doesn't look right. We should've come across stairs a while back.,おかしいわ。もう随分前に、階段に着いてないといけないはず。
story.Prologue_Hallway_2.event_confused.text.22193acf051b0af9fcdbb8535de61d888ff06000,That's true.,そうね。
story.Prologue_Hallway_2.event_confused.text.175daa26c02850f3d3aaac5090958fd37b23bb57,Maybe we took a wrong turn somewhere...?,どこかで道を間違えたのかしら……？
story.Prologue_Hallway_2.event_confused.text.55b8dd2670bef87bbac26fb9713727b6138302e4,Let's just keep going.,とにかく、先に進みましょう。
story.Prologue_Hallway_2.event_prevent_exit.text.fd525a9583efa833cfac41e09bad53f6f91f5c65,I want to see what's on the other side of this hallway.,廊下の反対側に何があるか見ておきたい。
